{
  "_note": "Sample OPERATOR-SIDE evaluation policy override for tools/Invoke-ReviewerEvaluation.ps1 -PolicyFile. It is STRICTER than the shipped default on every axis it touches, which is the only direction that has any effect: ConvertTo-ReviewerEvalEffectivePolicy clamps every cap DOWN to its code ceiling and every floor UP to its code floor, so a permissive value here is silently ignored. Note what is absent: partitionSalt, adjudicationSalt and holdoutPercent belong to the sealed corpus freeze and the harness throws if a policy file even mentions them. This file cannot enable a delivery gate, sign anything, or make suggestions unattended.",
  "schemaVersion": 1,
  "policyVersion": 2,
  "minExamples": 400,
  "minCalibrationExamples": 320,
  "minHoldoutExamples": 80,
  "minPerStratumExamples": 10,
  "minEligibleHoldoutFindings": 400,
  "minCommentPrecision": 0.985,
  "minCommentPrecisionLowerBound95": 0.96,
  "minCriticalAdjudicatedClaims": 100,
  "minApprovalDecisions": 500,
  "minWouldApproveDecisions": 100,
  "minAdjudicationCoverage": 0.99,
  "minLabelAgreementKappa": 0.75,
  "maxRecallRegression": 0.01,
  "maxCriticalFalsePositiveRate": 0.005,
  "maxFalseApprovalRate": 0.005,
  "maxExactTrials": 5000,
  "suggestionQualificationEnabled": false,
  "qualifiableScopes": [
    { "pack": "(generalist)", "severity": "important" }
  ]
}
